{
  "schema_version": "1.0.0",
  "record_type": "artifact_storage_plan",
  "record_status": "draft",
  "authority": "decision_input_only",
  "accepts_adr": false,
  "record_id": null,
  "prepared_at": null,
  "prepared_by": null,
  "decision_owner": null,
  "phase_scope": null,
  "primary_vault": null,
  "independent_backup": null,
  "independence_review": null,
  "capacity_envelope": null,
  "retention_rules": {
    "reproducibility_critical": null,
    "resume_only": null,
    "diagnostic": null,
    "disposable": null,
    "release": null
  },
  "recovery_point_objective": null,
  "transfer_plan": null,
  "restore_test_cadence": null,
  "cost_envelope": null,
  "owners": {
    "recovery_owner": null,
    "teardown_authority": null,
    "deletion_authority": null
  },
  "evidence_refs": {
    "static_check_ref": null,
    "copy_audit_ref": null,
    "storage_evidence_ref": null,
    "credential_access_audit_ref": null
  },
  "open_questions": [],
  "adr_ref": "docs/adr/0005-artifact-storage.md"
}
